<?xml version="1.0" encoding="UTF-8" standalone="no"?>
<!DOCTYPE booklist SYSTEM "booklist.dtd">

<booklist>

    <month>June</month>

    <book>
        <author>Ed Yong </author>
        <title> An Immense World: How Animal Senses Reveal the Hidden
        Realms Around Us</title>
        <year>2022</year>
        <publisher>Bodley Head</publisher>
        <reading>
            <start>20230601</start>
            <finish>20230614</finish>
        </reading>			
        <rating>3</rating> 
        <cover url="img/immenseworld.jpg"/>
    </book>

    <book>
        <author>Tom Holland </author>
        <title>Pax: War and Peace in Rome's Golden Age</title>
        <year>
        2023</year>
        <publisher>Abacus</publisher>
        <reading>
            <start>20230615</start>
            <finish>20230630</finish>
        </reading>			
        <rating>4</rating> 
        <cover url="img/pax.jpg"/>
    </book>

    <book>
        <author>James D. Tabor</author>
        <title>Paul and Jesus: How the Apostle Transformed
        Christianity</title>
        <year>2013</year>
        <publisher>Simon and Schuster </publisher>
        <reading>
            <start> </start>
            <finish> </finish>
        </reading>			
        <rating> </rating> 
        <cover url="img/paulandjesus.jpg"/>
    </book>
</booklist>